{
  "invocationId": "inv-fixture-visual-1",
  "attempt": 1,
  "callId": "att1.WyIxMTExMTExMS0xMTExLTQxMTEtODExMS0xMTExMTExMTExMTEiLCJjcmVhdGVfc3RhdGljX3ZhcmlhdGlvbiIsImludi1maXh0dXJlLXZpc3VhbC0xIiwxXQ",
  "tenantId": "11111111-1111-4111-8111-111111111111",
  "workflowKey": "copy-review",
  "agentKey": "design-agent",
  "actionKey": "create_static_variation",
  "trace": {
    "correlationId": "corr-fixture-1",
    "transactionId": "txn_fixture_1",
    "causationId": null,
    "parentTransactionId": null,
    "workflowId": "wf-fixture-1",
    "taskId": "task-fixture-1",
    "runId": "run-fixture-1"
  },
  "requestFingerprint": "hmac-sha256:v1:synthetic-test-v1:0f0f0f0f0f0f0f0f0f0f0f0f0f0f0f0f0f0f0f0f0f0f0f0f0f0f0f0f0f0f0f0f",
  "dataClassification": "synthetic",
  "classificationProvenance": [
    {
      "kind": "context_package",
      "ref": "ctx-fixture-1",
      "tenantId": "11111111-1111-4111-8111-111111111111",
      "classification": "synthetic"
    }
  ],
  "inputTokensEstimate": 400,
  "inputTokensEstimateMethod": "caller_hint",
  "profileRef": "fixture.image@1",
  "registryVersion": "local-test-1",
  "modelId": "local-test-image",
  "provider": "oplyra-test",
  "adapterKey": "test",
  "providerModelId": "oplyra-test/image",
  "tariffVersion": "local-test-0",
  "routingReason": "preferred",
  "fallbackOccurred": false,
  "resolvedProvider": "oplyra-test",
  "resolvedProviderModelId": "oplyra-test/image",
  "externalRequestId": "test-00000001",
  "outcome": "succeeded",
  "failureKind": null,
  "usage": {
    "inputTokens": 30,
    "outputTokens": 0,
    "images": 2
  },
  "outputAssetIds": [
    "asset-fixture-1",
    "asset-fixture-2"
  ],
  "estimatedCostMicroUsd": 0,
  "costMicroUsd": 0,
  "costStatus": "settled",
  "startedAt": "2026-09-29T18:00:00.000Z",
  "latencyMs": 5
}
